{
  "schema_version": 1,
  "status": "draft_local_not_uploaded",
  "release_id": "offline-audit-957fce5",
  "baseline_commit": "957fce550e8c4d0a71009b47e8f86e73d0780b19",
  "assets": [
    {
      "asset_id": "source:assets/backgrounds/Imagem do ChatGPT 28 de out. de 2026, 00_55_14.png",
      "source_path": "res://assets/backgrounds/Imagem do ChatGPT 28 de out. de 2026, 00_55_14.png",
      "character_id": null,
      "realm_id": null,
      "variant": "source",
      "format": "png",
      "size_bytes": 2763184,
      "sha256": "584bb9191912e7eb23c9553f35c9472d360ecb4e9b7f51a7c95b60fb1391a02d",
      "proposed_object_key": "sources/v1/shared/ui/584bb9191912e7eb23c9553f35c9472d360ecb4e9b7f51a7c95b60fb1391a02d/imagem-do-chatgpt-28-de-out.-de-2026-00_55_14.png",
      "publication_status": "not_uploaded",
      "runtime_ready": false
    },
    {
      "asset_id": "source:assets/characters/Cowboy/1.fbx",
      "source_path": "res://assets/characters/Cowboy/1.fbx",
      "character_id": "cowboy",
      "realm_id": null,
      "variant": "source",
      "format": "fbx",
      "size_bytes": 2292144,
      "sha256": "f956cdbad5d56a7e9924ed1a21e3d0059e92709a011f93974f50321ae8009e00",
      "proposed_object_key": "sources/v1/realms/shared/characters/cowboy/f956cdbad5d56a7e9924ed1a21e3d0059e92709a011f93974f50321ae8009e00/1.fbx",
      "publication_status": "not_uploaded",
      "runtime_ready": false
    },
    {
      "asset_id": "source:assets/characters/Cowboy/1_0.png",
      "source_path": "res://assets/characters/Cowboy/1_0.png",
      "character_id": "cowboy",
      "realm_id": null,
      "variant": "source",
      "format": "png",
      "size_bytes": 5035811,
      "sha256": "9eb68ebc7de2da4e7c5b109221c021a204f44273af69d05b7cf531a8ee9a75fc",
      "proposed_object_key": "sources/v1/realms/shared/characters/cowboy/9eb68ebc7de2da4e7c5b109221c021a204f44273af69d05b7cf531a8ee9a75fc/1_0.png",
      "publication_status": "not_uploaded",
      "runtime_ready": false
    },
    {
      "asset_id": "source:assets/characters/Cowboy/2.fbx",
      "source_path": "res://assets/characters/Cowboy/2.fbx",
      "character_id": "cowboy",
      "realm_id": null,
      "variant": "source",
      "format": "fbx",
      "size_bytes": 328528,
      "sha256": "8089df8e5c8db4a8e2a3a1b7b922f39c5bbe47ee2c4e0522f24bbb2db7ab6865",
      "proposed_object_key": "sources/v1/realms/shared/characters/cowboy/8089df8e5c8db4a8e2a3a1b7b922f39c5bbe47ee2c4e0522f24bbb2db7ab6865/2.fbx",
      "publication_status": "not_uploaded",
      "runtime_ready": false
    },
    {
      "asset_id": "source:assets/characters/Cowboy/3.fbx",
      "source_path": "res://assets/characters/Cowboy/3.fbx",
      "character_id": "cowboy",
      "realm_id": null,
      "variant": "source",
      "format": "fbx",
      "size_bytes": 354176,
      "sha256": "931f123596a6e2c6dc747432bb6ed761864d660b01308a3b6cb63abf7bd150f7",
      "proposed_object_key": "sources/v1/realms/shared/characters/cowboy/931f123596a6e2c6dc747432bb6ed761864d660b01308a3b6cb63abf7bd150f7/3.fbx",
      "publication_status": "not_uploaded",
      "runtime_ready": false
    },
    {
      "asset_id": "source:assets/characters/Cowboy/4.fbx",
      "source_path": "res://assets/characters/Cowboy/4.fbx",
      "character_id": "cowboy",
      "realm_id": null,
      "variant": "source",
      "format": "fbx",
      "size_bytes": 268768,
      "sha256": "e8d18074dad088e57a7d82fbb457de378f66be45a631733617aa4235e799ff9d",
      "proposed_object_key": "sources/v1/realms/shared/characters/cowboy/e8d18074dad088e57a7d82fbb457de378f66be45a631733617aa4235e799ff9d/4.fbx",
      "publication_status": "not_uploaded",
      "runtime_ready": false
    },
    {
      "asset_id": "source:assets/characters/Cowboy/Cowboy.mtl",
      "source_path": "res://assets/characters/Cowboy/Cowboy.mtl",
      "character_id": "cowboy",
      "realm_id": null,
      "variant": "source",
      "format": "mtl",
      "size_bytes": 174,
      "sha256": "adeaac9a57229962fc6cc5683020f7a1e148f07758d1417297f6bb499a499d06",
      "proposed_object_key": "sources/v1/realms/shared/characters/cowboy/adeaac9a57229962fc6cc5683020f7a1e148f07758d1417297f6bb499a499d06/cowboy.mtl",
      "publication_status": "not_uploaded",
      "runtime_ready": false
    },
    {
      "asset_id": "source:assets/characters/Cowboy/Cowboy.obj",
      "source_path": "res://assets/characters/Cowboy/Cowboy.obj",
      "character_id": "cowboy",
      "realm_id": null,
      "variant": "source",
      "format": "obj",
      "size_bytes": 2133048,
      "sha256": "36d627c77fde2edff291742ce6403237fbccd0b4d12f7edd3fe8bc9b4d711c89",
      "proposed_object_key": "sources/v1/realms/shared/characters/cowboy/36d627c77fde2edff291742ce6403237fbccd0b4d12f7edd3fe8bc9b4d711c89/cowboy.obj",
      "publication_status": "not_uploaded",
      "runtime_ready": false
    },
    {
      "asset_id": "source:assets/characters/Cowboy/Cowboy_basecolor.jpg",
      "source_path": "res://assets/characters/Cowboy/Cowboy_basecolor.jpg",
      "character_id": "cowboy",
      "realm_id": null,
      "variant": "source",
      "format": "jpg",
      "size_bytes": 525403,
      "sha256": "d6d7fe9434519bdfbcc24624a8994f4271e7c1c8bea2366d7c1e8a3caf933d8f",
      "proposed_object_key": "sources/v1/realms/shared/characters/cowboy/d6d7fe9434519bdfbcc24624a8994f4271e7c1c8bea2366d7c1e8a3caf933d8f/cowboy_basecolor.jpg",
      "publication_status": "not_uploaded",
      "runtime_ready": false
    },
    {
      "asset_id": "source:assets/characters/El fuego/Correr.fbx",
      "source_path": "res://assets/characters/El fuego/Correr.fbx",
      "character_id": "el_fuego",
      "realm_id": "desert",
      "variant": "source",
      "format": "fbx",
      "size_bytes": 24582048,
      "sha256": "bf902b3d66b4e4a412f1fb08182fe714322c037c6159542f40da5225c7518be6",
      "proposed_object_key": "sources/v1/realms/desert/characters/el_fuego/bf902b3d66b4e4a412f1fb08182fe714322c037c6159542f40da5225c7518be6/correr.fbx",
      "publication_status": "not_uploaded",
      "runtime_ready": false
    },
    {
      "asset_id": "source:assets/characters/El fuego/Correr_0.png",
      "source_path": "res://assets/characters/El fuego/Correr_0.png",
      "character_id": "el_fuego",
      "realm_id": "desert",
      "variant": "source",
      "format": "png",
      "size_bytes": 4532628,
      "sha256": "7a8a61869d53810e692b153527967d0edab38bd2a903406e111715fa09f6156a",
      "proposed_object_key": "sources/v1/realms/desert/characters/el_fuego/7a8a61869d53810e692b153527967d0edab38bd2a903406e111715fa09f6156a/correr_0.png",
      "publication_status": "not_uploaded",
      "runtime_ready": false
    },
    {
      "asset_id": "source:assets/characters/El fuego/El_fuego.mtl",
      "source_path": "res://assets/characters/El fuego/El_fuego.mtl",
      "character_id": "el_fuego",
      "realm_id": "desert",
      "variant": "source",
      "format": "mtl",
      "size_bytes": 181,
      "sha256": "c767feb962f637bb4f2c7b9c027b08986e9deac1821124a2800bdfb8a31becde",
      "proposed_object_key": "sources/v1/realms/desert/characters/el_fuego/c767feb962f637bb4f2c7b9c027b08986e9deac1821124a2800bdfb8a31becde/el_fuego.mtl",
      "publication_status": "not_uploaded",
      "runtime_ready": false
    },
    {
      "asset_id": "source:assets/characters/El fuego/El_fuego.obj",
      "source_path": "res://assets/characters/El fuego/El_fuego.obj",
      "character_id": "el_fuego",
      "realm_id": "desert",
      "variant": "source",
      "format": "obj",
      "size_bytes": 70014047,
      "sha256": "b3d83aeeaef7cb8a479cb57c469141fa24a19450bd06a55b80ee70e7dca88af3",
      "proposed_object_key": "sources/v1/realms/desert/characters/el_fuego/b3d83aeeaef7cb8a479cb57c469141fa24a19450bd06a55b80ee70e7dca88af3/el_fuego.obj",
      "publication_status": "not_uploaded",
      "runtime_ready": false
    },
    {
      "asset_id": "source:assets/characters/El fuego/El_fuego_basecolor.jpg",
      "source_path": "res://assets/characters/El fuego/El_fuego_basecolor.jpg",
      "character_id": "el_fuego",
      "realm_id": "desert",
      "variant": "source",
      "format": "jpg",
      "size_bytes": 1015410,
      "sha256": "65cc0dbc33fd69210a6dc56c8c6a9c9fe0cc62d207a8a76fc7aedbe25e22591f",
      "proposed_object_key": "sources/v1/realms/desert/characters/el_fuego/65cc0dbc33fd69210a6dc56c8c6a9c9fe0cc62d207a8a76fc7aedbe25e22591f/el_fuego_basecolor.jpg",
      "publication_status": "not_uploaded",
      "runtime_ready": false
    },
    {
      "asset_id": "source:assets/characters/El fuego/agachado.fbx",
      "source_path": "res://assets/characters/El fuego/agachado.fbx",
      "character_id": "el_fuego",
      "realm_id": "desert",
      "variant": "source",
      "format": "fbx",
      "size_bytes": 183776,
      "sha256": "5829092ebe4106d0a3e565bc688b227056fd79c4fded47037b68091f7c7b2358",
      "proposed_object_key": "sources/v1/realms/desert/characters/el_fuego/5829092ebe4106d0a3e565bc688b227056fd79c4fded47037b68091f7c7b2358/agachado.fbx",
      "publication_status": "not_uploaded",
      "runtime_ready": false
    },
    {
      "asset_id": "source:assets/characters/El fuego/ataque.fbx",
      "source_path": "res://assets/characters/El fuego/ataque.fbx",
      "character_id": "el_fuego",
      "realm_id": "desert",
      "variant": "source",
      "format": "fbx",
      "size_bytes": 327280,
      "sha256": "d2a290de5bb71d90d703647f541d73c44c891068af8665181389dcaee9122206",
      "proposed_object_key": "sources/v1/realms/desert/characters/el_fuego/d2a290de5bb71d90d703647f541d73c44c891068af8665181389dcaee9122206/ataque.fbx",
      "publication_status": "not_uploaded",
      "runtime_ready": false
    },
    {
      "asset_id": "source:assets/characters/El fuego/defesa.fbx",
      "source_path": "res://assets/characters/El fuego/defesa.fbx",
      "character_id": "el_fuego",
      "realm_id": "desert",
      "variant": "source",
      "format": "fbx",